{"document_type":"fixture_manifest","episode":"episodes/episode.synthetic.json","files":[{"location":{"path":"assets/fixture.blink/000000.png","root_id":"project"},"sha256":"5f05b16be0068d9440c9f8977f5861891daf677da15750cc1584e2213910cc4b","size_bytes":116},{"location":{"path":"assets/fixture.blink/000001.png","root_id":"project"},"sha256":"a00ab05757ff7a99beb2d6ade42261d3431a5430289c648e75091815109e632a","size_bytes":148},{"location":{"path":"assets/fixture.blink/000002.png","root_id":"project"},"sha256":"a00ab05757ff7a99beb2d6ade42261d3431a5430289c648e75091815109e632a","size_bytes":148},{"location":{"path":"assets/fixture.blink/000003.png","root_id":"project"},"sha256":"a00ab05757ff7a99beb2d6ade42261d3431a5430289c648e75091815109e632a","size_bytes":148},{"location":{"path":"assets/fixture.blink/000004.png","root_id":"project"},"sha256":"a00ab05757ff7a99beb2d6ade42261d3431a5430289c648e75091815109e632a","size_bytes":148},{"location":{"path":"assets/fixture.blink/000005.png","root_id":"project"},"sha256":"5f05b16be0068d9440c9f8977f5861891daf677da15750cc1584e2213910cc4b","size_bytes":116},{"location":{"path":"assets/fixture.cabin/image.png","root_id":"project"},"sha256":"075651480215d82622ab79ad4508933d7cd7db44f70052e33dda7684b1411a86","size_bytes":2325},{"location":{"path":"assets/fixture.entry/000000.png","root_id":"project"},"sha256":"f2cc892bdd66eab2ba5ce11ca23f56135f7542526aa299000998080fa2be1bca","size_bytes":342},{"location":{"path":"assets/fixture.entry/000001.png","root_id":"project"},"sha256":"ffe4502a4fe885cc436797b65d71ed1ce89384c6563c8c75fcad40074363f630","size_bytes":340},{"location":{"path":"assets/fixture.entry/000002.png","root_id":"project"},"sha256":"ea5ce6252ef8ccf4f0b7244d86d1e6d9aae380729c92e916dc3c3b373cad92b5","size_bytes":340},{"location":{"path":"assets/fixture.entry/000003.png","root_id":"project"},"sha256":"bbea0accecc100557f1f019dcb83ab6b7f0bf9540d6ea59e993511aa286fbd66","size_bytes":341},{"location":{"path":"assets/fixture.entry/000004.png","root_id":"project"},"sha256":"4650809ccd59c3a071ca80804c552ca401205c83cf81a53baab295a6a008168e","size_bytes":343},{"location":{"path":"assets/fixture.entry/000005.png","root_id":"project"},"sha256":"0816cf6f3f83b6d05c54624a4c4c97d798bf06c1fe68751c7744e60cc5d6761d","size_bytes":343},{"location":{"path":"assets/fixture.exit/000000.png","root_id":"project"},"sha256":"0816cf6f3f83b6d05c54624a4c4c97d798bf06c1fe68751c7744e60cc5d6761d","size_bytes":343},{"location":{"path":"assets/fixture.exit/000001.png","root_id":"project"},"sha256":"4650809ccd59c3a071ca80804c552ca401205c83cf81a53baab295a6a008168e","size_bytes":343},{"location":{"path":"assets/fixture.exit/000002.png","root_id":"project"},"sha256":"bbea0accecc100557f1f019dcb83ab6b7f0bf9540d6ea59e993511aa286fbd66","size_bytes":341},{"location":{"path":"assets/fixture.exit/000003.png","root_id":"project"},"sha256":"ea5ce6252ef8ccf4f0b7244d86d1e6d9aae380729c92e916dc3c3b373cad92b5","size_bytes":340},{"location":{"path":"assets/fixture.exit/000004.png","root_id":"project"},"sha256":"ffe4502a4fe885cc436797b65d71ed1ce89384c6563c8c75fcad40074363f630","size_bytes":340},{"location":{"path":"assets/fixture.exit/000005.png","root_id":"project"},"sha256":"f2cc892bdd66eab2ba5ce11ca23f56135f7542526aa299000998080fa2be1bca","size_bytes":342},{"location":{"path":"assets/fixture.far/image.png","root_id":"project"},"sha256":"a4621b1eed3bbde005587d1ca8e42b90593740f4cbe5426fc2feab784f6d028b","size_bytes":4994},{"location":{"path":"assets/fixture.foreground/image.png","root_id":"project"},"sha256":"0d156d81a9d9175aefba3fbe63fd74d3517b82cbcf732b57ea5427ca912de951","size_bytes":1210},{"location":{"path":"assets/fixture.idle/000000.png","root_id":"project"},"sha256":"f2cc892bdd66eab2ba5ce11ca23f56135f7542526aa299000998080fa2be1bca","size_bytes":342},{"location":{"path":"assets/fixture.idle/000001.png","root_id":"project"},"sha256":"bdc0981b48440ee3a93672fdf6a822fb25d443403d6631f77af26500a5b6460f","size_bytes":343},{"location":{"path":"assets/fixture.idle/000002.png","root_id":"project"},"sha256":"bdc0981b48440ee3a93672fdf6a822fb25d443403d6631f77af26500a5b6460f","size_bytes":343},{"location":{"path":"assets/fixture.idle/000003.png","root_id":"project"},"sha256":"ea8ecee47d44be12c4035fb98951ac87a39bf21463e0e08dfa885b4d0e30bd7a","size_bytes":342},{"location":{"path":"assets/fixture.idle/000004.png","root_id":"project"},"sha256":"ea8ecee47d44be12c4035fb98951ac87a39bf21463e0e08dfa885b4d0e30bd7a","size_bytes":342},{"location":{"path":"assets/fixture.idle/000005.png","root_id":"project"},"sha256":"bdc0981b48440ee3a93672fdf6a822fb25d443403d6631f77af26500a5b6460f","size_bytes":343},{"location":{"path":"assets/fixture.idle/000006.png","root_id":"project"},"sha256":"bdc0981b48440ee3a93672fdf6a822fb25d443403d6631f77af26500a5b6460f","size_bytes":343},{"location":{"path":"assets/fixture.idle/000007.png","root_id":"project"},"sha256":"f2cc892bdd66eab2ba5ce11ca23f56135f7542526aa299000998080fa2be1bca","size_bytes":342},{"location":{"path":"assets/fixture.idle/000008.png","root_id":"project"},"sha256":"e32b86a15e26b412d5274cac92bf9ede679cbeb5ec23cac4ab2f350a9f8dab30","size_bytes":343},{"location":{"path":"assets/fixture.idle/000009.png","root_id":"project"},"sha256":"e32b86a15e26b412d5274cac92bf9ede679cbeb5ec23cac4ab2f350a9f8dab30","size_bytes":343},{"location":{"path":"assets/fixture.idle/000010.png","root_id":"project"},"sha256":"f2cc892bdd66eab2ba5ce11ca23f56135f7542526aa299000998080fa2be1bca","size_bytes":342},{"location":{"path":"assets/fixture.idle/000011.png","root_id":"project"},"sha256":"f2cc892bdd66eab2ba5ce11ca23f56135f7542526aa299000998080fa2be1bca","size_bytes":342},{"location":{"path":"assets/fixture.landmark/image.png","root_id":"project"},"sha256":"462a4da746b671f2bb9a7e81e393e92948460e11aab3fd196bc19c8fb04b342a","size_bytes":332},{"location":{"path":"assets/fixture.mid/image.png","root_id":"project"},"sha256":"740b17ac46e7c87164c42595d7fd6a8c319d724729610606a3e77425d5dd140b","size_bytes":5047},{"location":{"path":"assets/fixture.near/image.png","root_id":"project"},"sha256":"d3c6fca0a11c0e1fc00ec9e295f777f7635b121291dae358571d4bd22c69c034","size_bytes":4712},{"location":{"path":"assets/fixture.observe/000000.png","root_id":"project"},"sha256":"0816cf6f3f83b6d05c54624a4c4c97d798bf06c1fe68751c7744e60cc5d6761d","size_bytes":343},{"location":{"path":"assets/fixture.observe/000001.png","root_id":"project"},"sha256":"ecfee138c93ae13e84020aa55539d173901417f12f1409c8fe54dcf200bbadde","size_bytes":344},{"location":{"path":"assets/fixture.observe/000002.png","root_id":"project"},"sha256":"ecfee138c93ae13e84020aa55539d173901417f12f1409c8fe54dcf200bbadde","size_bytes":344},{"location":{"path":"assets/fixture.observe/000003.png","root_id":"project"},"sha256":"978cd9a03e04845749b5313e0c69cf913d884ce573c784d33e0b185933c81b3c","size_bytes":343},{"location":{"path":"assets/fixture.observe/000004.png","root_id":"project"},"sha256":"978cd9a03e04845749b5313e0c69cf913d884ce573c784d33e0b185933c81b3c","size_bytes":343},{"location":{"path":"assets/fixture.observe/000005.png","root_id":"project"},"sha256":"ecfee138c93ae13e84020aa55539d173901417f12f1409c8fe54dcf200bbadde","size_bytes":344},{"location":{"path":"assets/fixture.observe/000006.png","root_id":"project"},"sha256":"ecfee138c93ae13e84020aa55539d173901417f12f1409c8fe54dcf200bbadde","size_bytes":344},{"location":{"path":"assets/fixture.observe/000007.png","root_id":"project"},"sha256":"0816cf6f3f83b6d05c54624a4c4c97d798bf06c1fe68751c7744e60cc5d6761d","size_bytes":343},{"location":{"path":"assets/fixture.observe/000008.png","root_id":"project"},"sha256":"10cfe4c7ba17b5b51133eac597bbd163fabf4de135704b260463342859782839","size_bytes":342},{"location":{"path":"assets/fixture.observe/000009.png","root_id":"project"},"sha256":"10cfe4c7ba17b5b51133eac597bbd163fabf4de135704b260463342859782839","size_bytes":342},{"location":{"path":"assets/fixture.observe/000010.png","root_id":"project"},"sha256":"0816cf6f3f83b6d05c54624a4c4c97d798bf06c1fe68751c7744e60cc5d6761d","size_bytes":343},{"location":{"path":"assets/fixture.observe/000011.png","root_id":"project"},"sha256":"0816cf6f3f83b6d05c54624a4c4c97d798bf06c1fe68751c7744e60cc5d6761d","size_bytes":343},{"location":{"path":"assets/fixture.window/image.png","root_id":"project"},"sha256":"8a533caa7e5cb33708b82c80f58a2327fe555bf030a6a6d8e57d60c758b13aa8","size_bytes":679},{"location":{"path":"audio/fixture.silence.wav","root_id":"project"},"sha256":"ede1f6dd33abfce7bb3a45ba79b0ab5f8baae692709dd32214a41da9af55ab13","size_bytes":192044},{"location":{"path":"audio/fixture.tone.wav","root_id":"project"},"sha256":"f0acb6b6957870747bc7a78694f4aa117d8796c587ec1950b59098cde15d4f0a","size_bytes":1920044},{"location":{"path":"episodes/episode.synthetic.json","root_id":"project"},"sha256":"fc8e07c94a35947d34eb2194d365f6d7a9df53b8911380cf4766f029d9cff183","size_bytes":3390},{"location":{"path":"project.json","root_id":"project"},"sha256":"3e33d752acee14d264b8cda76638e327949fed5f70d2c335f71163a627c99813","size_bytes":286},{"location":{"path":"registry/actions/pack.synthetic/1.0.json","root_id":"project"},"sha256":"26bb1fa5f96dbdc8a7e819d01b10251abcb83b331d21438aa6c551ba664a9aa9","size_bytes":1916},{"location":{"path":"registry/assets/fixture.blink/1.0.json","root_id":"project"},"sha256":"3b056be6e8183dd619749bea8b517424e6e601e1788d7949a348f5df493b6e1f","size_bytes":1949},{"location":{"path":"registry/assets/fixture.cabin/1.0.json","root_id":"project"},"sha256":"1429fe20347c53bdf0c621c0d0c35e1192fe441c9bc4819a31b74a901e7c4899","size_bytes":1080},{"location":{"path":"registry/assets/fixture.entry/1.0.json","root_id":"project"},"sha256":"27f5582774dd460d5045da238102c8a2c29650076b919c7c0f88acae6533dc20","size_bytes":1949},{"location":{"path":"registry/assets/fixture.exit/1.0.json","root_id":"project"},"sha256":"985d20d15c9f5daaaea5da09217b5a99b263fd302fde9717d592555921285b78","size_bytes":1941},{"location":{"path":"registry/assets/fixture.far/1.0.json","root_id":"project"},"sha25